
SQL*Plus: Release 11.2.0.2.0 Production on Fri Sep 11 09:13:17 2026

Copyright (c) 1982, 2014, Oracle.  All rights reserved.

SQL> create user qt237 identified by qt237;
SP2-0640: Not connected
SQL> connect / as sysdba;
Connected.
SQL> create user qt237 identified by qt237;

User created.

SQL> connect qt237
Enter password:
ERROR:
ORA-01045: user QT237 lacks CREATE SESSION privilege; logon denied


Warning: You are no longer connected to ORACLE.
SQL> connect / as sysdba;
Connected.
SQL> grant all priviliges to qt237;
grant all priviliges to qt237
      *
ERROR at line 1:
ORA-00990: missing or invalid privilege


SQL> grant all privileges to qt237;

Grant succeeded.

SQL> connect qt237
Enter password:
Connected.
SQL> connect / as sysdba;
Connected.
SQL> revoke all privileges from qt237;

Revoke succeeded.

SQL> connect qt237
Enter password:
ERROR:
ORA-01045: user QT237 lacks CREATE SESSION privilege; logon denied


Warning: You are no longer connected to ORACLE.
SQL> connect / as sysdba;
Connected.
SQL> grant all privileges to qt237;

Grant succeeded.

SQL>

SQL> connect qt237
Enter password:
Connected.
SQL> create table student(htno number(3),sname varchar2,marks number(2));
create table student(htno number(3),sname varchar2,marks number(2))
                                                  *
ERROR at line 1:
ORA-00906: missing left parenthesis


SQL> create table student(htno number(3),sname varchar2(10),marks number(2));

Table created.

SQL> desc student;
 Name                                      Null?    Type
 ----------------------------------------- -------- ----------------------------
 HTNO                                               NUMBER(3)
 SNAME                                              VARCHAR2(10)
 MARKS                                              NUMBER(2)

SQL> alter student add gender varchar2(10);
alter student add gender varchar2(10)
      *
ERROR at line 1:
ORA-00940: invalid ALTER command


SQL> alter table student add gender varchar2(10);

Table altered.

SQL> desc student;
 Name                                      Null?    Type
 ----------------------------------------- -------- ----------------------------
 HTNO                                               NUMBER(3)
 SNAME                                              VARCHAR2(10)
 MARKS                                              NUMBER(2)
 GENDER                                             VARCHAR2(10)

SQL> alter table student add percet varchar2(10);

Table altered.

SQL> desc student;
 Name                                      Null?    Type
 ----------------------------------------- -------- ----------------------------
 HTNO                                               NUMBER(3)
 SNAME                                              VARCHAR2(10)
 MARKS                                              NUMBER(2)
 GENDER                                             VARCHAR2(10)
 PERCET                                             VARCHAR2(10)

SQL> alter table student modify percet number(3);

Table altered.

SQL> alter table student rename column percet to percentage;

Table altered.

SQL> desc student;
 Name                                      Null?    Type
 ----------------------------------------- -------- ----------------------------
 HTNO                                               NUMBER(3)
 SNAME                                              VARCHAR2(10)
 MARKS                                              NUMBER(2)
 GENDER                                             VARCHAR2(10)
 PERCENTAGE                                         NUMBER(3)

SQL> alter table student drop column percentage;

Table altered.

SQL> desc student;
 Name                                      Null?    Type
 ----------------------------------------- -------- ----------------------------
 HTNO                                               NUMBER(3)
 SNAME                                              VARCHAR2(10)
 MARKS                                              NUMBER(2)
 GENDER                                             VARCHAR2(10)

SQL> rename student to stu1;

Table renamed.

SQL> desc student;
ERROR:
ORA-04043: object student does not exist


SQL> desc stu1;
 Name                                      Null?    Type
 ----------------------------------------- -------- ----------------------------
 HTNO                                               NUMBER(3)
 SNAME                                              VARCHAR2(10)
 MARKS                                              NUMBER(2)
 GENDER                                             VARCHAR2(10)

SQL> insert into stu1 values(101,'Ramu',99,'Male');

1 row created.

SQL> select * from stu1;

      HTNO SNAME           MARKS GENDER
---------- ---------- ---------- ----------
       101 Ramu               99 Male

SQL> insert into stu1 values(1022,'Ramu',99,'Male');
insert into stu1 values(1022,'Ramu',99,'Male')
                        *
ERROR at line 1:
ORA-01438: value larger than specified precision allowed for this column


SQL> insert into stu1 values(102,54522,99,'Male');

1 row created.

SQL> insert into stu1 values('102',54522,99,'Male');

1 row created.

SQL> insert into stu1 values('102',54522,99,Male);
insert into stu1 values('102',54522,99,Male)
                                       *
ERROR at line 1:
ORA-00984: column not allowed here


SQL> insert into stu1 values('krishna','ddferf',99,'Male');
insert into stu1 values('krishna','ddferf',99,'Male')
                        *
ERROR at line 1:
ORA-01722: invalid number


SQL> select * from stu1;

      HTNO SNAME           MARKS GENDER
---------- ---------- ---------- ----------
       101 Ramu               99 Male
       102 54522              99 Male
       102 54522              99 Male

SQL> insert into stu1 values(101,'Ramu');
insert into stu1 values(101,'Ramu')
            *
ERROR at line 1:
ORA-00947: not enough values


SQL> insert into stu1(htno,sname) values(104,'Krishna');

1 row created.

SQL> select * from stu1;

      HTNO SNAME           MARKS GENDER
---------- ---------- ---------- ----------
       101 Ramu               99 Male
       102 54522              99 Male
       102 54522              99 Male
       104 Krishna

SQL> insert into stu1(htno,gender) values(105,'Female');

1 row created.

SQL> select * from stu1;

      HTNO SNAME           MARKS GENDER
---------- ---------- ---------- ----------
       101 Ramu               99 Male
       102 54522              99 Male
       102 54522              99 Male
       104 Krishna
       105                       Female

SQL> insert into stu1 values(&htno,&sname,&marks,&gender);
Enter value for htno: 106
Enter value for sname: 'hdjdh'
Enter value for marks: 88
Enter value for gender: 'dfg'
old   1: insert into stu1 values(&htno,&sname,&marks,&gender)
new   1: insert into stu1 values(106,'hdjdh',88,'dfg')

1 row created.

SQL> /
Enter value for htno: 107
Enter value for sname: 'ghjhkj'
Enter value for marks: 77
Enter value for gender: 'gjkk'
old   1: insert into stu1 values(&htno,&sname,&marks,&gender)
new   1: insert into stu1 values(107,'ghjhkj',77,'gjkk')

1 row created.

SQL> /
Enter value for htno: 108
Enter value for sname: 'dfgdf'
Enter value for marks: 55
Enter value for gender: 'sdgsg'
old   1: insert into stu1 values(&htno,&sname,&marks,&gender)
new   1: insert into stu1 values(108,'dfgdf',55,'sdgsg')

1 row created.

SQL> select * from stu1;

      HTNO SNAME           MARKS GENDER
---------- ---------- ---------- ----------
       101 Ramu               99 Male
       102 54522              99 Male
       102 54522              99 Male
       104 Krishna
       105                       Female
       106 hdjdh              88 dfg
       107 ghjhkj             77 gjkk
       108 dfgdf              55 sdgsg

8 rows selected.

SQL> insert into stu1 values(&&htno,&&sname,&&marks,&&gender);
Enter value for htno: 109
Enter value for sname: 'Suresh'
Enter value for marks: 66
Enter value for gender: 'Male'
old   1: insert into stu1 values(&&htno,&&sname,&&marks,&&gender)
new   1: insert into stu1 values(109,'Suresh',66,'Male')

1 row created.

SQL> //
old   1: insert into stu1 values(&&htno,&&sname,&&marks,&&gender)
new   1: insert into stu1 values(109,'Suresh',66,'Male')

1 row created.

SQL> //
old   1: insert into stu1 values(&&htno,&&sname,&&marks,&&gender)
new   1: insert into stu1 values(109,'Suresh',66,'Male')

1 row created.

SQL> //
old   1: insert into stu1 values(&&htno,&&sname,&&marks,&&gender)
new   1: insert into stu1 values(109,'Suresh',66,'Male')

1 row created.

SQL> //
old   1: insert into stu1 values(&&htno,&&sname,&&marks,&&gender)
new   1: insert into stu1 values(109,'Suresh',66,'Male')

1 row created.

SQL> //
old   1: insert into stu1 values(&&htno,&&sname,&&marks,&&gender)
new   1: insert into stu1 values(109,'Suresh',66,'Male')

1 row created.

SQL> //
old   1: insert into stu1 values(&&htno,&&sname,&&marks,&&gender)
new   1: insert into stu1 values(109,'Suresh',66,'Male')

1 row created.

SQL> select * from stu1;

      HTNO SNAME           MARKS GENDER
---------- ---------- ---------- ----------
       101 Ramu               99 Male
       102 54522              99 Male
       102 54522              99 Male
       104 Krishna
       105                       Female
       106 hdjdh              88 dfg
       107 ghjhkj             77 gjkk
       108 dfgdf              55 sdgsg
       109 Suresh             66 Male
       109 Suresh             66 Male
       109 Suresh             66 Male

      HTNO SNAME           MARKS GENDER
---------- ---------- ---------- ----------
       109 Suresh             66 Male
       109 Suresh             66 Male
       109 Suresh             66 Male
       109 Suresh             66 Male

15 rows selected.

SQL>
======================

SQL*Plus: Release 11.2.0.2.0 Production on Sat Sep 12 09:06:31 2026

Copyright (c) 1982, 2014, Oracle.  All rights reserved.

SQL> connect qt237
Enter password:
Connected.
SQL> select * from tab;

TNAME                          TABTYPE  CLUSTERID
------------------------------ ------- ----------
STU1                           TABLE

SQL> desc stu1;
 Name                                      Null?    Type
 ----------------------------------------- -------- ----------------------------
 HTNO                                               NUMBER(3)
 SNAME                                              VARCHAR2(10)
 MARKS                                              NUMBER(2)
 GENDER                                             VARCHAR2(10)

SQL> select * from stu1;

      HTNO SNAME           MARKS GENDER
---------- ---------- ---------- ----------
       101 Ramu               99 Male
       102 54522              99 Male
       102 54522              99 Male
       104 Krishna
       105                       Female
       106 hdjdh              88 dfg
       107 ghjhkj             77 gjkk
       108 dfgdf              55 sdgsg
       109 Suresh             66 Male
       109 Suresh             66 Male
       109 Suresh             66 Male

      HTNO SNAME           MARKS GENDER
---------- ---------- ---------- ----------
       109 Suresh             66 Male
       109 Suresh             66 Male
       109 Suresh             66 Male
       109 Suresh             66 Male

15 rows selected.

SQL> select htno,sname,marks from stu1;

      HTNO SNAME           MARKS
---------- ---------- ----------
       101 Ramu               99
       102 54522              99
       102 54522              99
       104 Krishna
       105
       106 hdjdh              88
       107 ghjhkj             77
       108 dfgdf              55
       109 Suresh             66
       109 Suresh             66
       109 Suresh             66

      HTNO SNAME           MARKS
---------- ---------- ----------
       109 Suresh             66
       109 Suresh             66
       109 Suresh             66
       109 Suresh             66

15 rows selected.

SQL> select htno,sname,marks from stu1 where marks>=80;

      HTNO SNAME           MARKS
---------- ---------- ----------
       101 Ramu               99
       102 54522              99
       102 54522              99
       106 hdjdh              88

SQL> select htno,sname,marks from stu1 where marks>=80 and htno is not null;

      HTNO SNAME           MARKS
---------- ---------- ----------
       101 Ramu               99
       102 54522              99
       102 54522              99
       106 hdjdh              88

SQL> update stu1 set sname='QT';

15 rows updated.

SQL> select * from stu1;

      HTNO SNAME           MARKS GENDER
---------- ---------- ---------- ----------
       101 QT                 99 Male
       102 QT                 99 Male
       102 QT                 99 Male
       104 QT
       105 QT                    Female
       106 QT                 88 dfg
       107 QT                 77 gjkk
       108 QT                 55 sdgsg
       109 QT                 66 Male
       109 QT                 66 Male
       109 QT                 66 Male

      HTNO SNAME           MARKS GENDER
---------- ---------- ---------- ----------
       109 QT                 66 Male
       109 QT                 66 Male
       109 QT                 66 Male
       109 QT                 66 Male

15 rows selected.

SQL> rollback;

Rollback complete.

SQL> select * from stu1;

      HTNO SNAME           MARKS GENDER
---------- ---------- ---------- ----------
       101 Ramu               99 Male
       102 54522              99 Male
       102 54522              99 Male
       104 Krishna
       105                       Female
       106 hdjdh              88 dfg
       107 ghjhkj             77 gjkk
       108 dfgdf              55 sdgsg
       109 Suresh             66 Male
       109 Suresh             66 Male
       109 Suresh             66 Male

      HTNO SNAME           MARKS GENDER
---------- ---------- ---------- ----------
       109 Suresh             66 Male
       109 Suresh             66 Male
       109 Suresh             66 Male
       109 Suresh             66 Male

15 rows selected.

SQL> commit;

Commit complete.

SQL> update stu1 set sname='QT' where htno=105;

1 row updated.

SQL> select * from stu1;

      HTNO SNAME           MARKS GENDER
---------- ---------- ---------- ----------
       101 Ramu               99 Male
       102 54522              99 Male
       102 54522              99 Male
       104 Krishna
       105 QT                    Female
       106 hdjdh              88 dfg
       107 ghjhkj             77 gjkk
       108 dfgdf              55 sdgsg
       109 Suresh             66 Male
       109 Suresh             66 Male
       109 Suresh             66 Male

      HTNO SNAME           MARKS GENDER
---------- ---------- ---------- ----------
       109 Suresh             66 Male
       109 Suresh             66 Male
       109 Suresh             66 Male
       109 Suresh             66 Male

15 rows selected.

SQL> update stu1 set sname='Mohan',gender='Male',marks=45 where htno=107;

1 row updated.

SQL> select * from stu1;

      HTNO SNAME           MARKS GENDER
---------- ---------- ---------- ----------
       101 Ramu               99 Male
       102 54522              99 Male
       102 54522              99 Male
       104 Krishna
       105 QT                    Female
       106 hdjdh              88 dfg
       107 Mohan              45 Male
       108 dfgdf              55 sdgsg
       109 Suresh             66 Male
       109 Suresh             66 Male
       109 Suresh             66 Male

      HTNO SNAME           MARKS GENDER
---------- ---------- ---------- ----------
       109 Suresh             66 Male
       109 Suresh             66 Male
       109 Suresh             66 Male
       109 Suresh             66 Male

15 rows selected.

SQL> update stu1 set sname='Mohan',gender='Male',marks=45 where htno=117;

0 rows updated.

SQL>
SQL> commit;

Commit complete.

SQL> update stu1 set sname='Lalitha' where htno=106;

1 row updated.

SQL> select * from stu1;

      HTNO SNAME           MARKS GENDER
---------- ---------- ---------- ----------
       101 Ramu               99 Male
       102 54522              99 Male
       102 54522              99 Male
       104 Krishna
       105 QT                    Female
       106 Lalitha            88 dfg
       107 Mohan              45 Male
       108 dfgdf              55 sdgsg
       109 Suresh             66 Male
       109 Suresh             66 Male
       109 Suresh             66 Male

      HTNO SNAME           MARKS GENDER
---------- ---------- ---------- ----------
       109 Suresh             66 Male
       109 Suresh             66 Male
       109 Suresh             66 Male
       109 Suresh             66 Male

15 rows selected.

SQL> update stu1 set gender='female' where htno=106;

1 row updated.

SQL> select * from stu1;

      HTNO SNAME           MARKS GENDER
---------- ---------- ---------- ----------
       101 Ramu               99 Male
       102 54522              99 Male
       102 54522              99 Male
       104 Krishna
       105 QT                    Female
       106 Lalitha            88 female
       107 Mohan              45 Male
       108 dfgdf              55 sdgsg
       109 Suresh             66 Male
       109 Suresh             66 Male
       109 Suresh             66 Male

      HTNO SNAME           MARKS GENDER
---------- ---------- ---------- ----------
       109 Suresh             66 Male
       109 Suresh             66 Male
       109 Suresh             66 Male
       109 Suresh             66 Male

15 rows selected.

SQL> commit;

Commit complete.

SQL> commit;

Commit complete.

SQL> update stu1 set gender='gemale' where htno=106;

1 row updated.

SQL> select * from stu1;

      HTNO SNAME           MARKS GENDER
---------- ---------- ---------- ----------
       101 Ramu               99 Male
       102 54522              99 Male
       102 54522              99 Male
       104 Krishna
       105 QT                    Female
       106 Lalitha            88 gemale
       107 Mohan              45 Male
       108 dfgdf              55 sdgsg
       109 Suresh             66 Male
       109 Suresh             66 Male
       109 Suresh             66 Male

      HTNO SNAME           MARKS GENDER
---------- ---------- ---------- ----------
       109 Suresh             66 Male
       109 Suresh             66 Male
       109 Suresh             66 Male
       109 Suresh             66 Male

15 rows selected.

SQL> rollback;

Rollback complete.

SQL> select * from stu1;

      HTNO SNAME           MARKS GENDER
---------- ---------- ---------- ----------
       101 Ramu               99 Male
       102 54522              99 Male
       102 54522              99 Male
       104 Krishna
       105 QT                    Female
       106 Lalitha            88 female
       107 Mohan              45 Male
       108 dfgdf              55 sdgsg
       109 Suresh             66 Male
       109 Suresh             66 Male
       109 Suresh             66 Male

      HTNO SNAME           MARKS GENDER
---------- ---------- ---------- ----------
       109 Suresh             66 Male
       109 Suresh             66 Male
       109 Suresh             66 Male
       109 Suresh             66 Male

15 rows selected.

SQL> update stu1 set gender='gemale' where htno=106;

1 row updated.

SQL> select * from stu1;

      HTNO SNAME           MARKS GENDER
---------- ---------- ---------- ----------
       101 Ramu               99 Male
       102 54522              99 Male
       102 54522              99 Male
       104 Krishna
       105 QT                    Female
       106 Lalitha            88 gemale
       107 Mohan              45 Male
       108 dfgdf              55 sdgsg
       109 Suresh             66 Male
       109 Suresh             66 Male
       109 Suresh             66 Male

      HTNO SNAME           MARKS GENDER
---------- ---------- ---------- ----------
       109 Suresh             66 Male
       109 Suresh             66 Male
       109 Suresh             66 Male
       109 Suresh             66 Male

15 rows selected.

SQL> update stu1 set gender='gemakk' where htno=106;

1 row updated.

SQL> select * from stu1;

      HTNO SNAME           MARKS GENDER
---------- ---------- ---------- ----------
       101 Ramu               99 Male
       102 54522              99 Male
       102 54522              99 Male
       104 Krishna
       105 QT                    Female
       106 Lalitha            88 gemakk
       107 Mohan              45 Male
       108 dfgdf              55 sdgsg
       109 Suresh             66 Male
       109 Suresh             66 Male
       109 Suresh             66 Male

      HTNO SNAME           MARKS GENDER
---------- ---------- ---------- ----------
       109 Suresh             66 Male
       109 Suresh             66 Male
       109 Suresh             66 Male
       109 Suresh             66 Male

15 rows selected.

SQL> update stu1 set gender='gennkk' where htno=106;

1 row updated.

SQL> select * from stu1;

      HTNO SNAME           MARKS GENDER
---------- ---------- ---------- ----------
       101 Ramu               99 Male
       102 54522              99 Male
       102 54522              99 Male
       104 Krishna
       105 QT                    Female
       106 Lalitha            88 gennkk
       107 Mohan              45 Male
       108 dfgdf              55 sdgsg
       109 Suresh             66 Male
       109 Suresh             66 Male
       109 Suresh             66 Male

      HTNO SNAME           MARKS GENDER
---------- ---------- ---------- ----------
       109 Suresh             66 Male
       109 Suresh             66 Male
       109 Suresh             66 Male
       109 Suresh             66 Male

15 rows selected.

SQL> rollback;

Rollback complete.

SQL> select * from stu1;

      HTNO SNAME           MARKS GENDER
---------- ---------- ---------- ----------
       101 Ramu               99 Male
       102 54522              99 Male
       102 54522              99 Male
       104 Krishna
       105 QT                    Female
       106 Lalitha            88 female
       107 Mohan              45 Male
       108 dfgdf              55 sdgsg
       109 Suresh             66 Male
       109 Suresh             66 Male
       109 Suresh             66 Male

      HTNO SNAME           MARKS GENDER
---------- ---------- ---------- ----------
       109 Suresh             66 Male
       109 Suresh             66 Male
       109 Suresh             66 Male
       109 Suresh             66 Male

15 rows selected.

SQL> update stu1 set gender='gemakk' where htno=106;

1 row updated.

SQL> select * from stu1;

      HTNO SNAME           MARKS GENDER
---------- ---------- ---------- ----------
       101 Ramu               99 Male
       102 54522              99 Male
       102 54522              99 Male
       104 Krishna
       105 QT                    Female
       106 Lalitha            88 gemakk
       107 Mohan              45 Male
       108 dfgdf              55 sdgsg
       109 Suresh             66 Male
       109 Suresh             66 Male
       109 Suresh             66 Male

      HTNO SNAME           MARKS GENDER
---------- ---------- ---------- ----------
       109 Suresh             66 Male
       109 Suresh             66 Male
       109 Suresh             66 Male
       109 Suresh             66 Male

15 rows selected.

SQL> commit;

Commit complete.

SQL> update stu1 set gender='gemakk' where htno=106;

1 row updated.

SQL> select * from stu1;

      HTNO SNAME           MARKS GENDER
---------- ---------- ---------- ----------
       101 Ramu               99 Male
       102 54522              99 Male
       102 54522              99 Male
       104 Krishna
       105 QT                    Female
       106 Lalitha            88 gemakk
       107 Mohan              45 Male
       108 dfgdf              55 sdgsg
       109 Suresh             66 Male
       109 Suresh             66 Male
       109 Suresh             66 Male

      HTNO SNAME           MARKS GENDER
---------- ---------- ---------- ----------
       109 Suresh             66 Male
       109 Suresh             66 Male
       109 Suresh             66 Male
       109 Suresh             66 Male

15 rows selected.

SQL> update stu1 set gender='gennkk' where htno=106;

1 row updated.

SQL> select * from stu1;

      HTNO SNAME           MARKS GENDER
---------- ---------- ---------- ----------
       101 Ramu               99 Male
       102 54522              99 Male
       102 54522              99 Male
       104 Krishna
       105 QT                    Female
       106 Lalitha            88 gennkk
       107 Mohan              45 Male
       108 dfgdf              55 sdgsg
       109 Suresh             66 Male
       109 Suresh             66 Male
       109 Suresh             66 Male

      HTNO SNAME           MARKS GENDER
---------- ---------- ---------- ----------
       109 Suresh             66 Male
       109 Suresh             66 Male
       109 Suresh             66 Male
       109 Suresh             66 Male

15 rows selected.

SQL> rollback;

Rollback complete.

SQL> select * from stu1;

      HTNO SNAME           MARKS GENDER
---------- ---------- ---------- ----------
       101 Ramu               99 Male
       102 54522              99 Male
       102 54522              99 Male
       104 Krishna
       105 QT                    Female
       106 Lalitha            88 gemakk
       107 Mohan              45 Male
       108 dfgdf              55 sdgsg
       109 Suresh             66 Male
       109 Suresh             66 Male
       109 Suresh             66 Male

      HTNO SNAME           MARKS GENDER
---------- ---------- ---------- ----------
       109 Suresh             66 Male
       109 Suresh             66 Male
       109 Suresh             66 Male
       109 Suresh             66 Male

15 rows selected.

SQL> select * from tab;

TNAME                          TABTYPE  CLUSTERID
------------------------------ ------- ----------
STU1                           TABLE

SQL> create table stu2 as select * from stu1;

Table created.

SQL> select * from stu1;

      HTNO SNAME           MARKS GENDER
---------- ---------- ---------- ----------
       101 Ramu               99 Male
       102 54522              99 Male
       102 54522              99 Male
       104 Krishna
       105 QT                    Female
       106 Lalitha            88 gemakk
       107 Mohan              45 Male
       108 dfgdf              55 sdgsg
       109 Suresh             66 Male
       109 Suresh             66 Male
       109 Suresh             66 Male

      HTNO SNAME           MARKS GENDER
---------- ---------- ---------- ----------
       109 Suresh             66 Male
       109 Suresh             66 Male
       109 Suresh             66 Male
       109 Suresh             66 Male

15 rows selected.

SQL> select * from stu2;

      HTNO SNAME           MARKS GENDER
---------- ---------- ---------- ----------
       101 Ramu               99 Male
       102 54522              99 Male
       102 54522              99 Male
       104 Krishna
       105 QT                    Female
       106 Lalitha            88 gemakk
       107 Mohan              45 Male
       108 dfgdf              55 sdgsg
       109 Suresh             66 Male
       109 Suresh             66 Male
       109 Suresh             66 Male

      HTNO SNAME           MARKS GENDER
---------- ---------- ---------- ----------
       109 Suresh             66 Male
       109 Suresh             66 Male
       109 Suresh             66 Male
       109 Suresh             66 Male

15 rows selected.

SQL> select * from stu3;
select * from stu3
              *
ERROR at line 1:
ORA-00942: table or view does not exist


SQL> select * from tab;

TNAME                          TABTYPE  CLUSTERID
------------------------------ ------- ----------
STU1                           TABLE
STU2                           TABLE

SQL> create table stu3 as select htno,sname from stu1 where marks>=80;

Table created.

SQL> select * from stu3;

      HTNO SNAME
---------- ----------
       101 Ramu
       102 54522
       102 54522
       106 Lalitha

SQL> commit;

Commit complete.

SQL> rollback;

Rollback complete.

SQL> delete stu3;

4 rows deleted.

SQL> select * from stu3;

no rows selected

SQL> rollback;

Rollback complete.

SQL> select * from stu3;

      HTNO SNAME
---------- ----------
       101 Ramu
       102 54522
       102 54522
       106 Lalitha

SQL> commit;

Commit complete.

SQL> delete stu3 where htno=102;

2 rows deleted.

SQL> select * from stu3;

      HTNO SNAME
---------- ----------
       101 Ramu
       106 Lalitha

SQL> rollback;

Rollback complete.

SQL> select * from stu3;

      HTNO SNAME
---------- ----------
       101 Ramu
       102 54522
       102 54522
       106 Lalitha

SQL> commit;

Commit complete.

SQL> delete stu3 where htno=102;

2 rows deleted.

SQL> commit;

Commit complete.

SQL> select * from stu3;

      HTNO SNAME
---------- ----------
       101 Ramu
       106 Lalitha

SQL> rollback;

Rollback complete.

SQL> select * from stu3;

      HTNO SNAME
---------- ----------
       101 Ramu
       106 Lalitha

SQL> commit;

Commit complete.

SQL> truncate table stu3;

Table truncated.

SQL> select * from stu3;

no rows selected

SQL> rollback;

Rollback complete.

SQL> select * from stu3;

no rows selected

SQL> desc stu3;
 Name                                      Null?    Type
 ----------------------------------------- -------- ----------------------------
 HTNO                                               NUMBER(3)
 SNAME                                              VARCHAR2(10)

SQL> create table stu4 as select htno,sname from stu1 where marks>=80;

Table created.

SQL> select * from stu4;

      HTNO SNAME
---------- ----------
       101 Ramu
       102 54522
       102 54522
       106 Lalitha

SQL> drop table stu4;

Table dropped.

SQL> select * from stu4;
select * from stu4
              *
ERROR at line 1:
ORA-00942: table or view does not exist


SQL> desc stu4;
ERROR:
ORA-04043: object stu4 does not exist


SQL> select * from tab;

TNAME                          TABTYPE  CLUSTERID
------------------------------ ------- ----------
STU1                           TABLE
STU2                           TABLE
STU3                           TABLE

SQL> drop table stu3;

Table dropped.

SQL> select * from tab;

TNAME                          TABTYPE  CLUSTERID
------------------------------ ------- ----------
STU1                           TABLE
STU2                           TABLE

SQL> rollback;

Rollback complete.

SQL> select * from tab;

TNAME                          TABTYPE  CLUSTERID
------------------------------ ------- ----------
STU1                           TABLE
STU2                           TABLE

SQL> create table stu3 as select htno,sname from stu1 where marks>=80;

Table created.

SQL> select * from stu3;

      HTNO SNAME
---------- ----------
       101 Ramu
       102 54522
       102 54522
       106 Lalitha

SQL> commit;

Commit complete.

SQL> delete stu3 where htno=106;

1 row deleted.

SQL> select * from stu3;

      HTNO SNAME
---------- ----------
       101 Ramu
       102 54522
       102 54522

SQL> savepoint sp1;

Savepoint created.

SQL> delete stu3 where htno=101;

1 row deleted.

SQL> savepoint sp2;

Savepoint created.

SQL> select * from stu3;

      HTNO SNAME
---------- ----------
       102 54522
       102 54522

SQL> delete stu3 where htno=102;

2 rows deleted.

SQL> select * from stu3;

no rows selected

SQL> rollback to sp2;

Rollback complete.

SQL> select * from stu3;

      HTNO SNAME
---------- ----------
       102 54522
       102 54522

SQL> rollback to sp1;

Rollback complete.

SQL> select * from stu3;

      HTNO SNAME
---------- ----------
       101 Ramu
       102 54522
       102 54522

SQL> rollback;

Rollback complete.

SQL> select * from stu3;

      HTNO SNAME
---------- ----------
       101 Ramu
       102 54522
       102 54522
       106 Lalitha

SQL>